{
  "mandate_id": "mand_saas_seat_01",
  "issuer": "human:jaden",
  "holder": "agent:ops-1",
  "session_id": "sess_ops_02",
  "rail": "fake",
  "asset": "USD",
  "max_amount": { "minor_units": 5000, "currency": "USD" },
  "counterparty_policy": "allowlist:known-vendors",
  "purpose": "Renew one CI seat if and only if the current seat has lapsed.",
  "expires_at": "2026-07-04T00:00:00Z",
  "approval_threshold": { "minor_units": 2000, "mode": "human" },
  "idempotency_key": "mand_saas_seat_01:2026-07",
  "receipt_requirement": true
}
